<?xml version="1.0" encoding="utf-8" ?>
<curves xmlns:xsi="http://www.w3.org/2001/XMLSchema-instance"
        xsi:noNamespaceSchemaLocation="../schema.xsd">
    <curve>
        <id>secp112r1</id>
        <bits>112</bits>
        <field>prime</field>
        <file>secp112r1.csv</file>
    </curve>
    <curve>
        <id>secp112r2</id>
        <bits>112</bits>
        <field>prime</field>
        <file>secp112r2.csv</file>
    </curve>
    <curve>
        <id>secp128r1</id>
        <bits>128</bits>
        <field>prime</field>
        <file>secp128r1.csv</file>
    </curve>
    <curve>
        <id>secp128r2</id>
        <bits>128</bits>
        <field>prime</field>
        <file>secp128r2.csv</file>
    </curve>
    <curve>
        <id>secp160k1</id>
        <bits>160</bits>
        <field>prime</field>
        <file>secp160k1.csv</file>
    </curve>
    <curve>
        <id>secp160r1</id>
        <bits>160</bits>
        <field>prime</field>
        <file>secp160r1.csv</file>
    </curve>
    <curve>
        <id>secp160r2</id>
        <bits>160</bits>
        <field>prime</field>
        <file>secp160r2.csv</file>
    </curve>
    <curve>
        <id>secp192k1</id>
        <bits>192</bits>
        <field>prime</field>
        <file>secp192k1.csv</file>
    </curve>
    <curve>
        <id>secp192r1</id>
        <bits>192</bits>
        <field>prime</field>
        <file>secp192r1.csv</file>
    </curve>
    <curve>
        <id>secp224r1</id>
        <bits>224</bits>
        <field>prime</field>
        <file>secp224r1.csv</file>
    </curve>
    <curve>
        <id>secp256k1</id>
        <bits>256</bits>
        <field>prime</field>
        <file>secp256k1.csv</file>
    </curve>
    <curve>
        <id>secp256r1</id>
        <bits>256</bits>
        <field>prime</field>
        <file>secp256r1.csv</file>
    </curve>
    <curve>
        <id>secp384r1</id>
        <bits>384</bits>
        <field>prime</field>
        <file>secp384r1.csv</file>
    </curve>
    <curve>
        <id>secp521r1</id>
        <bits>521</bits>
        <field>prime</field>
        <file>secp521r1.csv</file>
    </curve>

    <curve>
        <id>sect163k1</id>
        <bits>163</bits>
        <field>binary</field>
        <file>sect163k1.csv</file>
    </curve>
    <curve>
        <id>sect163r1</id>
        <bits>163</bits>
        <field>binary</field>
        <file>sect163r1.csv</file>
    </curve>
    <curve>
        <id>sect163r2</id>
        <bits>163</bits>
        <field>binary</field>
        <file>sect163r2.csv</file>
    </curve>
    <curve>
        <id>sect233k1</id>
        <bits>233</bits>
        <field>binary</field>
        <file>sect233k1.csv</file>
    </curve>
    <curve>
        <id>sect233r1</id>
        <bits>233</bits>
        <field>binary</field>
        <file>sect233r1.csv</file>
    </curve>
    <curve>
        <id>sect239k1</id>
        <bits>233</bits>
        <field>binary</field>
        <file>sect239k1.csv</file>
    </curve>
    <curve>
        <id>sect283k1</id>
        <bits>283</bits>
        <field>binary</field>
        <file>sect283k1.csv</file>
    </curve>
    <curve>
        <id>sect283r1</id>
        <bits>283</bits>
        <field>binary</field>
        <file>sect283r1.csv</file>
    </curve>
    <curve>
        <id>sect409k1</id>
        <bits>409</bits>
        <field>binary</field>
        <file>sect409k1.csv</file>
    </curve>
    <curve>
        <id>sect409r1</id>
        <bits>409</bits>
        <field>binary</field>
        <file>sect409r1.csv</file>
    </curve>
    <curve>
        <id>sect571k1</id>
        <bits>571</bits>
        <field>binary</field>
        <file>sect571k1.csv</file>
    </curve>
    <curve>
        <id>sect571r1</id>
        <bits>571</bits>
        <field>binary</field>
        <file>sect571r1.csv</file>
    </curve>
</curves>