<?xml version="1.0" encoding="utf-8" ?>
<curves xmlns:xsi="http://www.w3.org/2001/XMLSchema-instance"
        xsi:noNamespaceSchemaLocation="../schema.xsd">
    <curve>
        <id>brainpoolP160r1</id>
        <bits>160</bits>
        <field>prime</field>
        <file>brainpoolP160r1.csv</file>
    </curve>
    <curve>
        <id>brainpoolP160t1</id>
        <bits>160</bits>
        <field>prime</field>
        <file>brainpoolP160t1.csv</file>
    </curve>
    <curve>
        <id>brainpoolP192r1</id>
        <bits>192</bits>
        <field>prime</field>
        <file>brainpoolP192r1.csv</file>
    </curve>
    <curve>
        <id>brainpoolP192t1</id>
        <bits>192</bits>
        <field>prime</field>
        <file>brainpoolP192t1.csv</file>
    </curve>
    <curve>
        <id>brainpoolP224r1</id>
        <bits>224</bits>
        <field>prime</field>
        <file>brainpoolP224r1.csv</file>
    </curve>
    <curve>
        <id>brainpoolP224t1</id>
        <bits>224</bits>
        <field>prime</field>
        <file>brainpoolP224t1.csv</file>
    </curve>
    <curve>
        <id>brainpoolP256r1</id>
        <bits>256</bits>
        <field>prime</field>
        <file>brainpoolP256r1.csv</file>
    </curve>
    <curve>
        <id>brainpoolP256t1</id>
        <bits>256</bits>
        <field>prime</field>
        <file>brainpoolP256t1.csv</file>
    </curve>
    <curve>
        <id>brainpoolP320r1</id>
        <bits>320</bits>
        <field>prime</field>
        <file>brainpoolP320r1.csv</file>
    </curve>
    <curve>
        <id>brainpoolP320t1</id>
        <bits>320</bits>
        <field>prime</field>
        <file>brainpoolP320t1.csv</file>
    </curve>
    <curve>
        <id>brainpoolP384r1</id>
        <bits>384</bits>
        <field>prime</field>
        <file>brainpoolP384r1.csv</file>
    </curve>
    <curve>
        <id>brainpoolP384t1</id>
        <bits>384</bits>
        <field>prime</field>
        <file>brainpoolP384t1.csv</file>
    </curve>
    <curve>
        <id>brainpoolP512r1</id>
        <bits>512</bits>
        <field>prime</field>
        <file>brainpoolP512r1.csv</file>
    </curve>
    <curve>
        <id>brainpoolP512t1</id>
        <bits>512</bits>
        <field>prime</field>
        <file>brainpoolP512t1.csv</file>
    </curve>
</curves>