<?xml version="1.0" encoding="utf-8" ?>
<curves xmlns:xsi="http://www.w3.org/2001/XMLSchema-instance"
        xsi:noNamespaceSchemaLocation="../schema.xsd">
    <curve>
        <id>bn158</id>
        <bits>158</bits>
        <field>prime</field>
        <file>bn158.csv</file>
        <desc>Barreto-Naehrig curve from eprint 2010/429.</desc>
    </curve>
    <curve>
        <id>bn190</id>
        <bits>190</bits>
        <field>prime</field>
        <file>bn190.csv</file>
        <desc>Barreto-Naehrig curve from eprint 2010/429.</desc>
    </curve>
    <curve>
        <id>bn222</id>
        <bits>222</bits>
        <field>prime</field>
        <file>bn222.csv</file>
        <desc>Barreto-Naehrig curve from eprint 2010/429.</desc>
    </curve>
    <curve>
        <id>bn254</id>
        <bits>254</bits>
        <field>prime</field>
        <file>bn254.csv</file>
        <desc>Barreto-Naehrig curve from eprint 2010/429.</desc>
    </curve>
    <curve>
        <id>bn286</id>
        <bits>286</bits>
        <field>prime</field>
        <file>bn286.csv</file>
        <desc>Barreto-Naehrig curve from eprint 2010/429.</desc>
    </curve>
    <curve>
        <id>bn318</id>
        <bits>318</bits>
        <field>prime</field>
        <file>bn318.csv</file>
        <desc>Barreto-Naehrig curve from eprint 2010/429.</desc>
    </curve>
    <curve>
        <id>bn350</id>
        <bits>350</bits>
        <field>prime</field>
        <file>bn350.csv</file>
        <desc>Barreto-Naehrig curve from eprint 2010/429.</desc>
    </curve>
    <curve>
        <id>bn382</id>
        <bits>382</bits>
        <field>prime</field>
        <file>bn382.csv</file>
        <desc>Barreto-Naehrig curve from eprint 2010/429.</desc>
    </curve>
    <curve>
        <id>bn414</id>
        <bits>414</bits>
        <field>prime</field>
        <file>bn414.csv</file>
        <desc>Barreto-Naehrig curve from eprint 2010/429.</desc>
    </curve>
    <curve>
        <id>bn446</id>
        <bits>446</bits>
        <field>prime</field>
        <file>bn446.csv</file>
        <desc>Barreto-Naehrig curve from eprint 2010/429.</desc>
    </curve>
    <curve>
        <id>bn478</id>
        <bits>478</bits>
        <field>prime</field>
        <file>bn478.csv</file>
        <desc>Barreto-Naehrig curve from eprint 2010/429.</desc>
    </curve>
    <curve>
        <id>bn510</id>
        <bits>510</bits>
        <field>prime</field>
        <file>bn510.csv</file>
        <desc>Barreto-Naehrig curve from eprint 2010/429.</desc>
    </curve>
    <curve>
        <id>bn542</id>
        <bits>542</bits>
        <field>prime</field>
        <file>bn542.csv</file>
        <desc>Barreto-Naehrig curve from eprint 2010/429.</desc>
    </curve>
    <curve>
        <id>bn574</id>
        <bits>574</bits>
        <field>prime</field>
        <file>bn574.csv</file>
        <desc>Barreto-Naehrig curve from eprint 2010/429.</desc>
    </curve>
    <curve>
        <id>bn606</id>
        <bits>606</bits>
        <field>prime</field>
        <file>bn606.csv</file>
        <desc>Barreto-Naehrig curve from eprint 2010/429.</desc>
    </curve>
    <curve>
        <id>bn638</id>
        <bits>638</bits>
        <field>prime</field>
        <file>bn638.csv</file>
        <desc>Barreto-Naehrig curve from eprint 2010/429.</desc>
    </curve>
</curves>