<?xml version="1.0" encoding="utf-8" ?>
<keys xmlns:xsi="http://www.w3.org/2001/XMLSchema-instance"
      xsi:noNamespaceSchemaLocation="../schema.xsd">
    <keypair>
        <id>secp160r1-U</id>
        <file>secg/secp160r1-keyU.csv</file>
        <curve>secg/secp160r1</curve>
    </keypair>
    <keypair>
        <id>secp160r1-V</id>
        <file>secg/secp160r1-keyV.csv</file>
        <curve>secg/secp160r1</curve>
    </keypair>
    <keypair>
        <id>sect163k1-U</id>
        <file>secg/sect163k1-keyU.csv</file>
        <curve>secg/sect163k1</curve>
    </keypair>
    <keypair>
        <id>sect163k1-V</id>
        <file>secg/sect163k1-keyV.csv</file>
        <curve>secg/sect163k1</curve>
    </keypair>

    <keypair>
        <id>brainpoolP224r1-A</id>
        <file>brainpool/brainpoolP224r1-keyA.csv</file>
        <curve>brainpool/brainpoolP224r1</curve>
    </keypair>
    <keypair>
        <id>brainpoolP224r1-B</id>
        <file>brainpool/brainpoolP224r1-keyB.csv</file>
        <curve>brainpool/brainpoolP224r1</curve>
    </keypair>
    <keypair>
        <id>brainpoolP256r1-A</id>
        <file>brainpool/brainpoolP256r1-keyA.csv</file>
        <curve>brainpool/brainpoolP256r1</curve>
    </keypair>
    <keypair>
        <id>brainpoolP256r1-B</id>
        <file>brainpool/brainpoolP256r1-keyB.csv</file>
        <curve>brainpool/brainpoolP256r1</curve>
    </keypair>
    <keypair>
        <id>brainpoolP384r1-A</id>
        <file>brainpool/brainpoolP384r1-keyA.csv</file>
        <curve>brainpool/brainpoolP384r1</curve>
    </keypair>
    <keypair>
        <id>brainpoolP384r1-B</id>
        <file>brainpool/brainpoolP384r1-keyB.csv</file>
        <curve>brainpool/brainpoolP384r1</curve>
    </keypair>
    <keypair>
        <id>brainpoolP512r1-A</id>
        <file>brainpool/brainpoolP512r1-keyA.csv</file>
        <curve>brainpool/brainpoolP512r1</curve>
    </keypair>
    <keypair>
        <id>brainpoolP512r1-B</id>
        <file>brainpool/brainpoolP512r1-keyB.csv</file>
        <curve>brainpool/brainpoolP512r1</curve>
    </keypair>

    <keypair>
        <id>p192-A</id>
        <file>nist/p192-keyIUT.csv</file>
        <curve>nist/P-192</curve>
    </keypair>
    <pubkey>
        <id>p192-B</id>
        <file>nist/p192-keyCAVS.csv</file>
        <curve>nist/P-192</curve>
    </pubkey>
    <keypair>
        <id>p224-A</id>
        <file>nist/p224-keyIUT.csv</file>
        <curve>nist/P-224</curve>
    </keypair>
    <pubkey>
        <id>p224-B</id>
        <file>nist/p224-keyCAVS.csv</file>
        <curve>nist/P-224</curve>
    </pubkey>
    <keypair>
        <id>p256-A</id>
        <file>nist/p256-keyIUT.csv</file>
        <curve>nist/P-256</curve>
    </keypair>
    <pubkey>
        <id>p256-B</id>
        <file>nist/p256-keyCAVS.csv</file>
        <curve>nist/P-256</curve>
    </pubkey>
    <keypair>
        <id>p384-A</id>
        <file>nist/p384-keyIUT.csv</file>
        <curve>nist/P-384</curve>
    </keypair>
    <pubkey>
        <id>p384-B</id>
        <file>nist/p384-keyCAVS.csv</file>
        <curve>nist/P-384</curve>
    </pubkey>
    <keypair>
        <id>p521-A</id>
        <file>nist/p521-keyIUT.csv</file>
        <curve>nist/P-521</curve>
    </keypair>
    <pubkey>
        <id>p521-B</id>
        <file>nist/p521-keyCAVS.csv</file>
        <curve>nist/P-521</curve>
    </pubkey>
    <keypair>
        <id>b163-A</id>
        <file>nist/b163-keyIUT.csv</file>
        <curve>nist/B-163</curve>
    </keypair>
    <pubkey>
        <id>b163-B</id>
        <file>nist/b163-keyCAVS.csv</file>
        <curve>nist/B-163</curve>
    </pubkey>
    <keypair>
        <id>b233-A</id>
        <file>nist/b233-keyIUT.csv</file>
        <curve>nist/B-233</curve>
    </keypair>
    <pubkey>
        <id>b233-B</id>
        <file>nist/b233-keyCAVS.csv</file>
        <curve>nist/B-233</curve>
    </pubkey>
    <keypair>
        <id>b283-A</id>
        <file>nist/b283-keyIUT.csv</file>
        <curve>nist/B-283</curve>
    </keypair>
    <pubkey>
        <id>b283-B</id>
        <file>nist/b283-keyCAVS.csv</file>
        <curve>nist/B-283</curve>
    </pubkey>
    <keypair>
        <id>b409-A</id>
        <file>nist/b409-keyIUT.csv</file>
        <curve>nist/B-409</curve>
    </keypair>
    <pubkey>
        <id>b409-B</id>
        <file>nist/b409-keyCAVS.csv</file>
        <curve>nist/B-409</curve>
    </pubkey>
    <keypair>
        <id>b571-A</id>
        <file>nist/b571-keyIUT.csv</file>
        <curve>nist/B-571</curve>
    </keypair>
    <pubkey>
        <id>b571-B</id>
        <file>nist/b571-keyCAVS.csv</file>
        <curve>nist/B-571</curve>
    </pubkey>
    <keypair>
        <id>k163-A</id>
        <file>nist/k163-keyIUT.csv</file>
        <curve>nist/K-163</curve>
    </keypair>
    <pubkey>
        <id>k163-B</id>
        <file>nist/k163-keyCAVS.csv</file>
        <curve>nist/K-163</curve>
    </pubkey>
    <keypair>
        <id>k233-A</id>
        <file>nist/k233-keyIUT.csv</file>
        <curve>nist/K-233</curve>
    </keypair>
    <pubkey>
        <id>k233-B</id>
        <file>nist/k233-keyCAVS.csv</file>
        <curve>nist/K-233</curve>
    </pubkey>
    <keypair>
        <id>k283-A</id>
        <file>nist/k283-keyIUT.csv</file>
        <curve>nist/K-283</curve>
    </keypair>
    <pubkey>
        <id>k283-B</id>
        <file>nist/k283-keyCAVS.csv</file>
        <curve>nist/K-283</curve>
    </pubkey>
    <keypair>
        <id>k409-A</id>
        <file>nist/k409-keyIUT.csv</file>
        <curve>nist/K-409</curve>
    </keypair>
    <pubkey>
        <id>k409-B</id>
        <file>nist/k409-keyCAVS.csv</file>
        <curve>nist/K-409</curve>
    </pubkey>
    <keypair>
        <id>k571-A</id>
        <file>nist/k571-keyIUT.csv</file>
        <curve>nist/K-571</curve>
    </keypair>
    <pubkey>
        <id>k571-B</id>
        <file>nist/k571-keyCAVS.csv</file>
        <curve>nist/K-571</curve>
    </pubkey>
</keys>